url,title,description,keywords,body,topics
https://www.cnn.com/2013/06/10/politics/edward-snowden-profile/,"Man behind NSA leaks says he did it to safeguard privacy, liberty | CNN Politics",Edward Snowden might never live in the U.S. as a free man again after leaking secrets about a U.S. surveillance program,,"[{""@type"":""NewsArticle"",""@context"":""https://schema.org"",""articleBody"":""He’s a high school dropout who worked his way into the most secretive computers in U.S. intelligence as a defense contractor – only to blow those secrets wide open by spilling details of classified surveillance programs. Now, Edward Snowden might never live in the United States as a free man again. Where he may end up was a source of global speculation Sunday after he flew from Hong Kong to Russia, his ultimate destination un",politics
https://www.walmart.com/blocked?url=L2lwL0FwcGxlLWlQaG9uZS0xMy0xMjhHQi1CbHVlLzExMDY4MDY2Nw==&uuid=0e4c4033-1d0f-11f0-b3dc-cef4b90e1a41&vid=&g=b,Robot or human?,,,"Robot or human? Activate and hold the button to confirm that you’re human. Thank You! window._pxAppId = 'PXu6b0qd2S'; window._pxJsClientSrc = '/px/' + window._pxAppId + '/init.js'; window._pxFirstPartyEnabled = true; window._pxHostUrl = '/px/' + window._pxAppId + '/xhr'; window._pxreCaptchaTheme = 'light'; window._PXETnJ2Y5H = { challenge: { view: { textFont: ""BogleWeb, Helvetica Neue, Helvetica, Arial, sans-serif"" } } }; var hc = getUrlParam('g', 'b'); var alt = hc if (alt=='a') { document.getE",
https://www.rtings.com/tv/reviews/lg/c3-oled,"LG C3 OLED Review (OLED42C3PUA, OLED48C3PUA, OLED55C3PUA, OLED65C3PUA, OLED77C3PUA, OLED83C3PUA) - RTINGS.com","The LG C3 OLED is the mid-range model in LG's 2023 OLED lineup, sitting above the entry-level OLED 'B' series LG B3 OLED and below the 'Gallery Style' LG G3 OLED...",,PRELOAD.preload(); Get insider access Sign Up Log In Sign Up Log In Get insider access Preferred store 🇦🇺 Australia 🇧🇪 Belgium 🇧🇷 Brazil 🇨🇦 Canada 🇫🇷 France 🇩🇪 Germany 🌎 Global 🇮🇳 India 🇮🇪 Ireland 🇮🇹 Italy 🇯🇵 Japan 🇳🇱 Netherlands 🇵🇱 Poland 🇸🇦 Saudi Arabia 🇸🇬 Singapore 🇪🇸 Spain 🇸🇪 Sweden 🇦🇪 United Arab Emirates 🇬🇧 United Kingdom 🇺🇸 United States Auto Reviews TV REVIEWS v2.0 HEADPHONES REVIEWS v1.8 MONITOR REVIEWS v2.0.1 SOUNDBAR REVIEWS v1.3 MOUSE REVIEWS v1.5 KEYBOARD REVIEWS v1.3.1 PRINTER REVI,
https://www.amazon.com/Cuisinart-CPT-122-2-Slice-Compact-Plastic/dp/B009GQ034C,"Amazon.com: Cuisinart 2-Slice Toaster, Compact, White, CPT-122: Home & Kitchen","Online Shopping for Kitchen Small Appliances from a great selection of Coffee Machines, Blenders, Juicers, Ovens, Specialty Appliances, & more at everyday low prices",,"{""AUI_TEMPLATE_WEBLAB_CACHE_333406"":""C"",""BW_AUI_CXC_ALERT_MEASUREMENT_1074111"":""C"",""AUI_72554"":""C"",""AUI_A11Y_6_837773"":""C"",""AUI_KILLSWITCH_CSA_LOGGER_372963"":""T1""} typeof uex === 'function' && uex('ld', 'portal-bb', {wb: 1}) !function(n){function e(n,e){return{m:n,a:function(n){return[].slice.call(n)}(e)}}document.createElement(""header"");var r=function(n){function u(n,r,u){n[u]=function(){a._replay.push(r.concat(e(u,arguments)))}}var a={};return a._sourceName=n,a._replay=[],a.getNow=function(n,e",outdoors
https://www.bestbuy.com/site/apple-airpods-pro-2nd-generation-with-usb-c-white/6525163.p,Best Buy International: Select your Country - Best Buy,Shop online at Best Buy in your country and language of choice. Best Buy provides online shopping in a number of countries and languages.," best buy international, best buy countries",English Français Español Hello! Choose a country. Canada United States Shopping in the U.S.? International customers can shop on www.bestbuy.com and have orders shipped to any U.S. address or U.S. store. See More Details Bonjour! Choisir un pays : Canada United States Vous magasinez aux É.-U.? Les clients internationaux peuvent magasiner au www.bestbuy.com et faire livrer leurs commandes à n’importe quelle adresse ou n’importe quel magasin aux États-Unis. Voir les détails ¡Hola! Seleciona un paí,
